{
  "schemaVersion": "visual-analysis.v0.2.0-draft.1",
  "summary": {
    "caption": "A minimal sketch on paper.",
    "description": "An image with minimal visual details showing a simple line sketch on white paper."
  },
  "visualInfo": {
    "imageKind": "handwrittenNote",
    "imageKindConfidence": 0.9,
    "sceneDescription": "A hand-drawn geometric outline on clean paper.",
    "visibleElements": [
      {
        "label": "paper sheet",
        "category": "document",
        "confidence": 0.95
      }
    ],
    "visibleText": [],
    "uncertainties": []
  },
  "indexing": {
    "keywords": [
      {
        "value": "sketch",
        "confidence": 0.9,
        "importance": 0.8
      }
    ]
  },
  "quality": {
    "confidence": 0.95,
    "issues": []
  }
}
